parameter;id;value;min;max;step;commentn_commands;cmds;3;1;10;1;Number of commandsn_selection;select;5;1;200;5;Number of command selections_zipfian;zipf;1;1;5;1;The parameter s of the Zipf lawn_strategy;strategy;3;2;3;1;Number of Strategies: MENU, HOTKEY (+Learning)  menu_time;TimeM;1.12;0.05;3;0.05; Minimum menu selection timehotkey_time;TimeH;0.5;0.05;2;0.05;Minimum hotkey selection timelearning_cost;learning;0.5;0.05;2;0.05;temporal cost of learning hotkeyserror_cost;error;0.5;0.05;2;0.05;temporal cost of an eror